{
  "$schema": "../../short-series.schema.json",
  "id": "dk-conversations",
  "title": "DK英语会话",
  "summary": "从简短、常见的日常交流开始，逐段熟悉自然英语会话。",
  "eyebrow": "DK Conversations",
  "experienceLabel": "DK Conversation",
  "contentType": "conversation-experiences",
  "cover": "boarding-gate",
  "order": 1
}
