{
  "$schema": "../../short-series.schema.json",
  "id": "common-conversations",
  "title": "常见情景会话",
  "summary": "练习出行、问路和日常办事时经常遇到的简短英语交流。",
  "eyebrow": "Everyday Conversations",
  "experienceLabel": "Common Conversation",
  "contentType": "conversation-experiences",
  "cover": "metro-station",
  "order": 2
}
